{
  "schema": "dryer.controller-build-plan/v2",
  "controller": "mainboard",
  "lock_hash": "sha256:a4a5e7876b44d72279f48f1868b3dd2e08c5aa5e63dde12e0a43186ced4d51d1",
  "board": "boards/example-mainboard@1.0.0",
  "chip": "chips/generic-mcu@1.5.0",
  "target_triple": "thumbv7em-none-eabihf",
  "toolchain": "rustc-1.85.0",
  "build_profile": "release",
  "protocol_version": "dryer.control/v1",
  "abi_version": "dryer.controller/v1",
  "flash_bytes": 524288,
  "ram_bytes": 131072,
  "bootloader_offset_bytes": 16384,
  "features": [
    "adc",
    "pwm",
    "step_scheduler",
    "usb_transport"
  ],
  "native_drivers": [
    "devices/tmc2209@2.1.0"
  ],
  "resolved_resources": {
    "hotend_heater/output": "heater0",
    "hotend_sensor/input": "thermistor0",
    "x_driver/connected_to": "motor0",
    "y_driver/connected_to": "motor1",
    "z_driver/connected_to": "motor2"
  },
  "safety": {
    "schema": "dryer.controller-safety/v1",
    "states": [
      {
        "component": "hotend_heater",
        "class": "heater",
        "resource": "heater0",
        "state": "off",
        "heartbeat_timeout_us": 500000,
        "sensor": "thermistor0"
      },
      {
        "component": "x_motor",
        "class": "stepper_motor",
        "resource": "motor0",
        "state": "disabled"
      },
      {
        "component": "y_motor",
        "class": "stepper_motor",
        "resource": "motor1",
        "state": "disabled"
      },
      {
        "component": "z_motor",
        "class": "stepper_motor",
        "resource": "motor2",
        "state": "disabled"
      }
    ]
  },
  "expected_artifact": {
    "format": "dryer.controller-image/v1",
    "path": "build/mainboard/firmware.dryer.json",
    "size_bytes": 1600,
    "sha256": "sha256:bb33956025312dd25f8bde38b94e17c9d9e67e7f0b374b66b78a65a00112a116",
    "deployable": false
  }
}
